<?xml version="1.0"?>
<!DOCTYPE Report
[
<!ELEMENT Report (General ,(Doc|BPT)) >
<!ATTLIST Report ver CDATA #REQUIRED tmZone CDATA #REQUIRED>

<!ELEMENT General ( DocLocation ) >
<!ATTLIST General productName CDATA #REQUIRED productVer CDATA #REQUIRED os CDATA #REQUIRED host CDATA #REQUIRED qcserver CDATA #IMPLIED qcproject CDATA #IMPLIED SolManSolutionId CDATA #IMPLIED SolManProjectId CDATA #IMPLIED SolManTestPlanId CDATA #IMPLIED SolManTestPackageId CDATA #IMPLIED SolManUserInfoData CDATA #IMPLIED  >

<!ELEMENT BPT (DName,Res,DVer?,TSet?,TInst?,NodeArgs,AdditionalInfo*,Doc*) >
<!ATTLIST BPT rID ID #REQUIRED >

<!ELEMENT Doc (DName,ConfName?,Res,DVer?,TSet?,TInst?,RunType?,DT?,AdditionalInfo*,Step*,DIter*,Step*,Action*,Doc*,Summary?,TestMaintenanceSummary*,NodeArgs?) >
<!ATTLIST Doc rID ID #REQUIRED type (Test|BC|BPTWrapperTest|Flow|Group|Action) "Test" productName CDATA #REQUIRED BCIter CDATA #IMPLIED >

<!ELEMENT RunType ( #PCDATA )>
<!ATTLIST RunType fmStep (False|True) "False" batch (False|True) "False" upDesc (False|True) "False" upChk (False|True) "False" upAS (False|True) "False">

<!ELEMENT DName ( #PCDATA ) >

<!ELEMENT ConfName ( #PCDATA ) >

<!ELEMENT Res ( #PCDATA ) >

<!ELEMENT AdditionalInfo (AdditionalDataName,AdditionalDataValue ) >

<!ELEMENT AdditionalDataName ( #PCDATA ) >

<!ELEMENT AdditionalDataValue ( #PCDATA ) >

<!ELEMENT DVer ( #PCDATA ) >

<!ELEMENT TSet ( #PCDATA ) >

<!ELEMENT TInst ( #PCDATA ) >

<!ELEMENT DIter (Step*,Action+,Summary?,NodeArgs)>
<!ATTLIST DIter rID ID #REQUIRED iterID CDATA #REQUIRED>

<!ELEMENT DocLocation ( #PCDATA )>

<!ELEMENT Action (AName,AIter*,(Step|HtmlStep|Action)*, Summary,ActionMaintenanceSummary*, NodeArgs ) >
<!ATTLIST Action rID ID #REQUIRED>

<!ELEMENT AIter ((Step|HtmlStep|Action)*,DataMapping?, Summary?,NodeArgs) >
<!ATTLIST AIter rID ID #REQUIRED iterID CDATA #REQUIRED isCountable (False|True) "False" >

<!ELEMENT AName ( #PCDATA ) >

<!ELEMENT TestMaintenanceSummary (ActionMaintenanceSummary*) >
<!ATTLIST TestMaintenanceSummary ObjectsAdded CDATA #REQUIRED ObjectsUpdated CDATA #REQUIRED StepsUpdated CDATA #REQUIRED StepsComments CDATA #REQUIRED><!ELEMENT ActionMaintenanceSummary (ObjectChange* ) >
<!ATTLIST ActionMaintenanceSummary Action CDATA #REQUIRED Objects CDATA #REQUIRED Updated CDATA #REQUIRED LinesTotal CDATA #REQUIRED Added CDATA #REQUIRED LinesUpdated CDATA #REQUIRED>

<!ELEMENT ObjectChange  (Hierarchy, PropertyChangeList* ) >
<!ATTLIST ObjectChange Operation CDATA #IMPLIED OriginalRepository CDATA #IMPLIED>

<!ELEMENT PropertyChangeList (PropertyDef*) >

<!ELEMENT PropertyDef (OriginalValue, NewValue) >
<!ATTLIST PropertyDef PropName CDATA #REQUIRED OriginRegularExpression (True|False) "False" NewRegularExpression (True|False) "False" AddedProperty (True|False) "False" >

<!ELEMENT OriginalValue ( #PCDATA )>

<!ELEMENT NewValue ( #PCDATA )>

<!ELEMENT Hierarchy  (ObjectName, Hierarchy*) >
<!ATTLIST Hierarchy MicClass CDATA #REQUIRED>

<!ELEMENT ObjectName  ( #PCDATA ) >

<!ELEMENT Step (Obj,Details,Time,TimeTick* ,(Step|HtmlStep|Doc)*, DataMapping?, NodeArgs) >
<!ATTLIST Step rID ID #REQUIRED retval CDATA #IMPLIED>

<!ELEMENT HtmlStep (HTML,TimeTick*,(Step|HtmlStep|Doc)*,NodeArgs) >
<!ATTLIST HtmlStep rID ID #REQUIRED >

<!ELEMENT Obj ( #PCDATA ) >
<!ATTLIST Obj plainTxt (False|True) "True">

<!ELEMENT Details ( #PCDATA ) >
<!ATTLIST Details plainTxt (False|True) "True">

<!ELEMENT Time ( #PCDATA ) >

<!ELEMENT HTML ( #PCDATA ) >

<!ELEMENT Disp ( #PCDATA ) >

<!ELEMENT TimeTick ( #PCDATA ) >

<!ELEMENT DataMapping ( DataMappedItem* )>
<!ELEMENT DataMappedItem EMPTY >
<!ATTLIST DataMappedItem dsName CDATA #REQUIRED >
<!ATTLIST DataMappedItem rowId CDATA #REQUIRED >

<!ELEMENT NodeArgs (Disp,TopPane?,BtmPane?,ExtendedInfo? )>
<!ATTLIST NodeArgs eType CDATA #REQUIRED icon CDATA #REQUIRED nRep CDATA #REQUIRED UserNote CDATA #IMPLIED filter (False|True) "True">
<!ATTLIST NodeArgs status (Passed|Failed|Done|Warning|Information) "Done">
<!ATTLIST NodeArgs iconSel CDATA #IMPLIED nType CDATA #IMPLIED MovieMarker CDATA "">
<!ATTLIST NodeArgs Source CDATA #IMPLIED SourceLine CDATA #IMPLIED StepFlowItemKey CDATA #IMPLIED >

<!ELEMENT TopPane (Path)>

<!ELEMENT BtmPane ( (Path|WR)?,ASHilite?)>
<!ATTLIST BtmPane vType CDATA "HTML">

<!ELEMENT Path ( #PCDATA ) >

<!ELEMENT ASHilite ( #PCDATA ) >

<!ELEMENT WR ( #PCDATA ) >

<!ELEMENT ExtendedInfo ( StepData ) >

<!ATTLIST ExtendedInfo StepType CDATA #REQUIRED>
<!ELEMENT DT (NodeArgs) >
<!ATTLIST DT rID ID #REQUIRED>

<!ELEMENT Summary (Param*)>
<!ATTLIST Summary sTime CDATA #IMPLIED eTime CDATA #IMPLIED passed CDATA #IMPLIED failed CDATA #IMPLIED warnings CDATA #IMPLIED retval CDATA #IMPLIED stopped (False|True) "False" >

<!ELEMENT Param (ParamName,ParamVal)+ >
<!ATTLIST Param paramInOut (In|Out) "In">

<!ELEMENT ParamName ( #PCDATA ) >

<!ELEMENT ParamVal ( #PCDATA ) >

]
>
<Report ver="2.0" tmZone="W. Europe Standard Time">
<General productName="HP Unified Functional Testing" productVer="12.02" os="Windows 7" host="ITINBAC-DW0406"><DocLocation><![CDATA[\\PTPSEELM-NT1045.ikeadt.com\TAC\Wave 3 Automation\NWPSmokePack0.4-UnderMaintenance-DontTouch-vignes\Driver]]></DocLocation></General>
<Doc rID="T1"   productName= "HP Unified Functional Testing"  >
<DName><![CDATA[Driver]]></DName>
<Res><![CDATA[Res18]]></Res>
<DT rID="T2">
<NodeArgs eType="Table" icon="2" nRep="4" filter="False" >
<Disp><![CDATA[Run-Time Data Table]]></Disp>
<BtmPane vType="Table" >
<Path><![CDATA[Default_0.xls]]></Path>
</BtmPane>
</NodeArgs>
</DT>
<Step rID="T3">
<Obj ><![CDATA[Excel Sheet Import]]></Obj>
<Details ><![CDATA[Excel Sheet  Applications Import to Applications operation Done Succefully]]></Details>
<Time><![CDATA[2/17/2016 - 13:18:58]]></Time>
<TimeTick>1455711538</TimeTick>
<NodeArgs eType="User" icon="3" nRep="6" status="Passed" >
<Disp><![CDATA[Excel Sheet Import]]></Disp>
</NodeArgs>
</Step>
<Action rID="T4">
<AName><![CDATA[Driver]]></AName>
<Step rID="T5">
<Obj plainTxt="False" ><![CDATA[[ Browser ].Exist]]></Obj>
<Details plainTxt="False" ><![CDATA["Object does not exist"]]></Details>
<Time><![CDATA[2/17/2016 - 13:19:01]]></Time>
<TimeTick>1455711541</TimeTick>
<NodeArgs eType="Replay" icon="5" nRep="9" >
<Disp><![CDATA[[ Browser ].Exist]]></Disp>
</NodeArgs>
</Step>
<Step rID="T6">
<Obj ><![CDATA[Excel Sheet Import]]></Obj>
<Details ><![CDATA[Excel Sheet  Global Import to Global operation Done Succefully]]></Details>
<Time><![CDATA[2/17/2016 - 13:19:02]]></Time>
<TimeTick>1455711542</TimeTick>
<NodeArgs eType="User" icon="3" nRep="10" status="Passed" >
<Disp><![CDATA[Excel Sheet Import]]></Disp>
</NodeArgs>
</Step>
<Step rID="T7">
<Obj plainTxt="False" ><![CDATA[NWPFE]]></Obj>
<Details plainTxt="False" ><![CDATA[Browser]]></Details>
<Time><![CDATA[2/17/2016 - 13:19:04]]></Time>
<TimeTick>1455711544</TimeTick>
<Step rID="T8">
<Obj plainTxt="False" ><![CDATA[NWPFE]]></Obj>
<Details plainTxt="False" ><![CDATA[Page]]></Details>
<Time><![CDATA[2/17/2016 - 13:19:04]]></Time>
<TimeTick>1455711544</TimeTick>
<Step rID="T9">
<Obj plainTxt="False" ><![CDATA[NWPFE.Exist]]></Obj>
<Details plainTxt="False" ><![CDATA["Object does not exist"]]></Details>
<Time><![CDATA[2/17/2016 - 13:19:04]]></Time>
<TimeTick>1455711544</TimeTick>
<NodeArgs eType="Replay" icon="6" nRep="19" >
<Disp><![CDATA[NWPFE.Exist]]></Disp>
</NodeArgs>
</Step>
<Step rID="T10">
<Obj plainTxt="False" ><![CDATA[SystemUtil]]></Obj>
<Details plainTxt="False" ><![CDATA[SystemUtil]]></Details>
<Time><![CDATA[2/17/2016 - 13:19:08]]></Time>
<TimeTick>1455711548</TimeTick>
<Step rID="T11">
<Obj plainTxt="False" ><![CDATA[Run "firefox.exe",1]]></Obj>
<Details plainTxt="False" ><![CDATA[Run "firefox.exe",1]]></Details>
<Time><![CDATA[2/17/2016 - 13:19:08]]></Time>
<TimeTick>1455711548</TimeTick>
<NodeArgs eType="Replay" icon="7" nRep="23" status="Passed" >
<Disp><![CDATA[Run "firefox.exe",1]]></Disp>
</NodeArgs>
</Step>
<NodeArgs eType="Replay" icon="7" nRep="22" status="Passed" >
<Disp><![CDATA[SystemUtil]]></Disp>
</NodeArgs>
</Step>
<NodeArgs eType="Context" icon="6" nRep="18" status="Passed" >
<Disp><![CDATA[NWPFE]]></Disp>
</NodeArgs>
</Step>
<Step rID="T12">
<Obj plainTxt="False" ><![CDATA[NWPFE.Exist]]></Obj>
<Details plainTxt="False" ><![CDATA["Object exists"]]></Details>
<Time><![CDATA[2/17/2016 - 13:19:33]]></Time>
<TimeTick>1455711573</TimeTick>
<NodeArgs eType="Replay" icon="5" nRep="24" >
<Disp><![CDATA[NWPFE.Exist]]></Disp>
</NodeArgs>
</Step>
<Step rID="T13">
<Obj plainTxt="False" ><![CDATA[NWPFE.Exist]]></Obj>
<Details plainTxt="False" ><![CDATA["Object exists"]]></Details>
<Time><![CDATA[2/17/2016 - 13:19:33]]></Time>
<TimeTick>1455711573</TimeTick>
<NodeArgs eType="Replay" icon="5" nRep="25" >
<Disp><![CDATA[NWPFE.Exist]]></Disp>
</NodeArgs>
</Step>
<NodeArgs eType="Context" icon="5" nRep="17" status="Passed" >
<Disp><![CDATA[NWPFE]]></Disp>
</NodeArgs>
</Step>
<Step rID="T14">
<Obj ><![CDATA[CheckBrowserExist]]></Obj>
<Details ><![CDATA[Browser exist]]></Details>
<Time><![CDATA[2/17/2016 - 13:19:33]]></Time>
<TimeTick>1455711573</TimeTick>
<NodeArgs eType="User" icon="3" nRep="26" >
<Disp><![CDATA[CheckBrowserExist]]></Disp>
</NodeArgs>
</Step>
<Step rID="T15">
<Obj plainTxt="False" ><![CDATA[NWPFE]]></Obj>
<Details plainTxt="False" ><![CDATA[Browser]]></Details>
<Time><![CDATA[2/17/2016 - 13:19:33]]></Time>
<TimeTick>1455711573</TimeTick>
<Step rID="T16">
<Obj plainTxt="False" ><![CDATA[NWPFE.Refresh All Tabs]]></Obj>
<Details plainTxt="False" ><![CDATA[]]></Details>
<Time><![CDATA[2/17/2016 - 13:19:33]]></Time>
<TimeTick>1455711573</TimeTick>
<NodeArgs eType="Replay" icon="5" nRep="29" >
<Disp><![CDATA[NWPFE.Refresh All Tabs]]></Disp>
</NodeArgs>
</Step>
<Step rID="T17">
<Obj plainTxt="False" ><![CDATA[NWPFE]]></Obj>
<Details plainTxt="False" ><![CDATA[Page]]></Details>
<Time><![CDATA[2/17/2016 - 13:19:37]]></Time>
<TimeTick>1455711577</TimeTick>
<Step rID="T18">
<Obj plainTxt="False" ><![CDATA[[ Link ].Exist]]></Obj>
<Details plainTxt="False" ><![CDATA["Object does not exist"]]></Details>
<Time><![CDATA[2/17/2016 - 13:19:37]]></Time>
<TimeTick>1455711577</TimeTick>
<NodeArgs eType="Replay" icon="8" nRep="57" >
<Disp><![CDATA[[ Link ].Exist]]></Disp>
</NodeArgs>
</Step>
<Step rID="T19">
<Obj plainTxt="False" ><![CDATA[[ United Kingdom (en) ].Exist]]></Obj>
<Details plainTxt="False" ><![CDATA["Object exists"]]></Details>
<Time><![CDATA[2/17/2016 - 13:19:37]]></Time>
<TimeTick>1455711577</TimeTick>
<NodeArgs eType="Replay" icon="8" nRep="58" >
<Disp><![CDATA[[ United Kingdom (en) ].Exist]]></Disp>
</NodeArgs>
</Step>
<NodeArgs eType="Context" icon="6" nRep="56" >
<Disp><![CDATA[NWPFE]]></Disp>
</NodeArgs>
</Step>
<NodeArgs eType="Context" icon="5" nRep="28" >
<Disp><![CDATA[NWPFE]]></Disp>
</NodeArgs>
</Step>
<Step rID="T20">
<Obj ><![CDATA[FE_ClickOn_Link]]></Obj>
<Details ><![CDATA[United Kingdom (en) link verified successfully.]]></Details>
<Time><![CDATA[2/17/2016 - 13:19:37]]></Time>
<TimeTick>1455711577</TimeTick>
<NodeArgs eType="User" icon="3" nRep="60" >
<Disp><![CDATA[FE_ClickOn_Link]]></Disp>
</NodeArgs>
</Step>
<Step rID="T21">
<Obj plainTxt="False" ><![CDATA[[ United Kingdom (en) ].Click]]></Obj>
<Details plainTxt="False" ><![CDATA[]]></Details>
<Time><![CDATA[2/17/2016 - 13:19:37]]></Time>
<TimeTick>1455711577</TimeTick>
<NodeArgs eType="Replay" icon="8" nRep="62" >
<Disp><![CDATA[[ United Kingdom (en) ].Click]]></Disp>
</NodeArgs>
</Step>
<Step rID="T22">
<Obj plainTxt="False" ><![CDATA[NWPFE]]></Obj>
<Details plainTxt="False" ><![CDATA[Browser]]></Details>
<Time><![CDATA[2/17/2016 - 13:19:40]]></Time>
<TimeTick>1455711580</TimeTick>
<Step rID="T23">
<Obj plainTxt="False" ><![CDATA[NWPFE]]></Obj>
<Details plainTxt="False" ><![CDATA[Page]]></Details>
<Time><![CDATA[2/17/2016 - 13:19:40]]></Time>
<TimeTick>1455711580</TimeTick>
<Step rID="T24">
<Obj plainTxt="False" ><![CDATA[NWPFE.Sync]]></Obj>
<Details plainTxt="False" ><![CDATA[]]></Details>
<Time><![CDATA[2/17/2016 - 13:19:40]]></Time>
<TimeTick>1455711580</TimeTick>
<NodeArgs eType="Replay" icon="6" nRep="67" >
<Disp><![CDATA[NWPFE.Sync]]></Disp>
</NodeArgs>
</Step>
<NodeArgs eType="Context" icon="6" nRep="66" >
<Disp><![CDATA[NWPFE]]></Disp>
</NodeArgs>
</Step>
<NodeArgs eType="Context" icon="5" nRep="65" >
<Disp><![CDATA[NWPFE]]></Disp>
</NodeArgs>
</Step>
<Step rID="T25">
<Obj ><![CDATA[FE_ClickOn_Link]]></Obj>
<Details ><![CDATA[United Kingdom (en) link clicked successfully.]]></Details>
<Time><![CDATA[2/17/2016 - 13:19:44]]></Time>
<TimeTick>1455711584</TimeTick>
<NodeArgs eType="User" icon="3" nRep="68" >
<Disp><![CDATA[FE_ClickOn_Link]]></Disp>
</NodeArgs>
</Step>
<Step rID="T26">
<Obj ><![CDATA[FE_ClickOn_Link]]></Obj>
<Details ><![CDATA[ All links clicked successfully.]]></Details>
<Time><![CDATA[2/17/2016 - 13:19:44]]></Time>
<TimeTick>1455711584</TimeTick>
<NodeArgs eType="User" icon="3" nRep="69" >
<Disp><![CDATA[FE_ClickOn_Link]]></Disp>
</NodeArgs>
</Step>
<Step rID="T27">
<Obj plainTxt="False" ><![CDATA[NWPFE]]></Obj>
<Details plainTxt="False" ><![CDATA[Browser]]></Details>
<Time><![CDATA[2/17/2016 - 13:19:44]]></Time>
<TimeTick>1455711584</TimeTick>
<Step rID="T28">
<Obj plainTxt="False" ><![CDATA[NWPFE]]></Obj>
<Details plainTxt="False" ><![CDATA[Page]]></Details>
<Time><![CDATA[2/17/2016 - 13:19:44]]></Time>
<TimeTick>1455711584</TimeTick>
<Step rID="T29">
<Obj plainTxt="False" ><![CDATA[txtSearch.Exist]]></Obj>
<Details plainTxt="False" ><![CDATA["Object exists"]]></Details>
<Time><![CDATA[2/17/2016 - 13:19:44]]></Time>
<TimeTick>1455711584</TimeTick>
<NodeArgs eType="Replay" icon="9" nRep="73" >
<Disp><![CDATA[txtSearch.Exist]]></Disp>
</NodeArgs>
</Step>
<NodeArgs eType="Context" icon="6" nRep="72" >
<Disp><![CDATA[NWPFE]]></Disp>
</NodeArgs>
</Step>
<NodeArgs eType="Context" icon="5" nRep="71" >
<Disp><![CDATA[NWPFE]]></Disp>
</NodeArgs>
</Step>
<Step rID="T30">
<Obj ><![CDATA[CheckObject]]></Obj>
<Details ><![CDATA[WebEdit  - SearchExist]]></Details>
<Time><![CDATA[2/17/2016 - 13:19:44]]></Time>
<TimeTick>1455711584</TimeTick>
<NodeArgs eType="User" icon="3" nRep="74" >
<Disp><![CDATA[CheckObject]]></Disp>
</NodeArgs>
</Step>
<Step rID="T31">
<Obj plainTxt="False" ><![CDATA[NWPFE]]></Obj>
<Details plainTxt="False" ><![CDATA[Browser]]></Details>
<Time><![CDATA[2/17/2016 - 13:19:45]]></Time>
<TimeTick>1455711585</TimeTick>
<Step rID="T32">
<Obj plainTxt="False" ><![CDATA[NWPFE]]></Obj>
<Details plainTxt="False" ><![CDATA[Page]]></Details>
<Time><![CDATA[2/17/2016 - 13:19:45]]></Time>
<TimeTick>1455711585</TimeTick>
<Step rID="T33">
<Obj plainTxt="False" ><![CDATA[txtSearch.Exist]]></Obj>
<Details plainTxt="False" ><![CDATA["Object exists"]]></Details>
<Time><![CDATA[2/17/2016 - 13:19:45]]></Time>
<TimeTick>1455711585</TimeTick>
<NodeArgs eType="Replay" icon="9" nRep="77" >
<Disp><![CDATA[txtSearch.Exist]]></Disp>
</NodeArgs>
</Step>
<Step rID="T34">
<Obj plainTxt="False" ><![CDATA[txtSearch.Click]]></Obj>
<Details plainTxt="False" ><![CDATA[]]></Details>
<Time><![CDATA[2/17/2016 - 13:19:45]]></Time>
<TimeTick>1455711585</TimeTick>
<NodeArgs eType="Replay" icon="9" nRep="79" >
<Disp><![CDATA[txtSearch.Click]]></Disp>
</NodeArgs>
</Step>
<Step rID="T35">
<Obj plainTxt="False" ><![CDATA[txtSearch.Set]]></Obj>
<Details plainTxt="False" ><![CDATA[""]]></Details>
<Time><![CDATA[2/17/2016 - 13:19:45]]></Time>
<TimeTick>1455711585</TimeTick>
<NodeArgs eType="Replay" icon="9" nRep="81" >
<Disp><![CDATA[txtSearch.Set]]></Disp>
</NodeArgs>
</Step>
<NodeArgs eType="Context" icon="6" nRep="76" >
<Disp><![CDATA[NWPFE]]></Disp>
</NodeArgs>
</Step>
<NodeArgs eType="Context" icon="5" nRep="75" >
<Disp><![CDATA[NWPFE]]></Disp>
</NodeArgs>
</Step>
<Step rID="T36">
<Obj ><![CDATA[TakeAction]]></Obj>
<Details ><![CDATA[WebEdit  - Search
Entered - ]]></Details>
<Time><![CDATA[2/17/2016 - 13:19:45]]></Time>
<TimeTick>1455711585</TimeTick>
<NodeArgs eType="User" icon="3" nRep="82" >
<Disp><![CDATA[TakeAction]]></Disp>
</NodeArgs>
</Step>
<Step rID="T37">
<Obj plainTxt="False" ><![CDATA[NWPFE]]></Obj>
<Details plainTxt="False" ><![CDATA[Browser]]></Details>
<Time><![CDATA[2/17/2016 - 13:19:46]]></Time>
<TimeTick>1455711586</TimeTick>
<Step rID="T38">
<Obj plainTxt="False" ><![CDATA[NWPFE]]></Obj>
<Details plainTxt="False" ><![CDATA[Page]]></Details>
<Time><![CDATA[2/17/2016 - 13:19:46]]></Time>
<TimeTick>1455711586</TimeTick>
<Step rID="T39">
<Obj plainTxt="False" ><![CDATA[txtSearch.Exist]]></Obj>
<Details plainTxt="False" ><![CDATA["Object exists"]]></Details>
<Time><![CDATA[2/17/2016 - 13:19:46]]></Time>
<TimeTick>1455711586</TimeTick>
<NodeArgs eType="Replay" icon="9" nRep="85" >
<Disp><![CDATA[txtSearch.Exist]]></Disp>
</NodeArgs>
</Step>
<Step rID="T40">
<Obj plainTxt="False" ><![CDATA[txtSearch.Click]]></Obj>
<Details plainTxt="False" ><![CDATA[]]></Details>
<Time><![CDATA[2/17/2016 - 13:19:46]]></Time>
<TimeTick>1455711586</TimeTick>
<NodeArgs eType="Replay" icon="9" nRep="87" >
<Disp><![CDATA[txtSearch.Click]]></Disp>
</NodeArgs>
</Step>
<Step rID="T41">
<Obj plainTxt="False" ><![CDATA[txtSearch.Set]]></Obj>
<Details plainTxt="False" ><![CDATA["901.245.34"]]></Details>
<Time><![CDATA[2/17/2016 - 13:19:46]]></Time>
<TimeTick>1455711586</TimeTick>
<NodeArgs eType="Replay" icon="9" nRep="89" >
<Disp><![CDATA[txtSearch.Set]]></Disp>
</NodeArgs>
</Step>
<NodeArgs eType="Context" icon="6" nRep="84" >
<Disp><![CDATA[NWPFE]]></Disp>
</NodeArgs>
</Step>
<NodeArgs eType="Context" icon="5" nRep="83" >
<Disp><![CDATA[NWPFE]]></Disp>
</NodeArgs>
</Step>
<Step rID="T42">
<Obj ><![CDATA[TakeAction]]></Obj>
<Details ><![CDATA[WebEdit  - Search
Entered - 901.245.34]]></Details>
<Time><![CDATA[2/17/2016 - 13:19:46]]></Time>
<TimeTick>1455711586</TimeTick>
<NodeArgs eType="User" icon="3" nRep="90" >
<Disp><![CDATA[TakeAction]]></Disp>
</NodeArgs>
</Step>
<Step rID="T43">
<Obj plainTxt="False" ><![CDATA[NWPFE]]></Obj>
<Details plainTxt="False" ><![CDATA[Browser]]></Details>
<Time><![CDATA[2/17/2016 - 13:19:47]]></Time>
<TimeTick>1455711587</TimeTick>
<Step rID="T44">
<Obj plainTxt="False" ><![CDATA[NWPFE]]></Obj>
<Details plainTxt="False" ><![CDATA[Page]]></Details>
<Time><![CDATA[2/17/2016 - 13:19:47]]></Time>
<TimeTick>1455711587</TimeTick>
<Step rID="T45">
<Obj plainTxt="False" ><![CDATA[btnSearch.Exist]]></Obj>
<Details plainTxt="False" ><![CDATA["Object exists"]]></Details>
<Time><![CDATA[2/17/2016 - 13:19:47]]></Time>
<TimeTick>1455711587</TimeTick>
<NodeArgs eType="Replay" icon="10" nRep="93" >
<Disp><![CDATA[btnSearch.Exist]]></Disp>
</NodeArgs>
</Step>
<Step rID="T46">
<Obj plainTxt="False" ><![CDATA[btnSearch.Click]]></Obj>
<Details plainTxt="False" ><![CDATA[]]></Details>
<Time><![CDATA[2/17/2016 - 13:19:47]]></Time>
<TimeTick>1455711587</TimeTick>
<NodeArgs eType="Replay" icon="10" nRep="95" >
<Disp><![CDATA[btnSearch.Click]]></Disp>
</NodeArgs>
</Step>
<Step rID="T47">
<Obj plainTxt="False" ><![CDATA[eleArticleNo.Exist]]></Obj>
<Details plainTxt="False" ><![CDATA["Object exists"]]></Details>
<Time><![CDATA[2/17/2016 - 13:19:50]]></Time>
<TimeTick>1455711590</TimeTick>
<NodeArgs eType="Replay" icon="11" nRep="96" >
<Disp><![CDATA[eleArticleNo.Exist]]></Disp>
</NodeArgs>
</Step>
<NodeArgs eType="Context" icon="6" nRep="92" >
<Disp><![CDATA[NWPFE]]></Disp>
</NodeArgs>
</Step>
<NodeArgs eType="Context" icon="5" nRep="91" >
<Disp><![CDATA[NWPFE]]></Disp>
</NodeArgs>
</Step>
<Step rID="T48">
<Obj ><![CDATA[To verify an article no of a product in search]]></Obj>
<Details ><![CDATA[Article No901.245.34verified in FE successfully]]></Details>
<Time><![CDATA[2/17/2016 - 13:19:50]]></Time>
<TimeTick>1455711590</TimeTick>
<NodeArgs eType="User" icon="3" nRep="97" >
<Disp><![CDATA[To verify an article no of a product in search]]></Disp>
</NodeArgs>
</Step>
<Step rID="T49">
<Obj plainTxt="False" ><![CDATA[NWPFE]]></Obj>
<Details plainTxt="False" ><![CDATA[Browser]]></Details>
<Time><![CDATA[2/17/2016 - 13:19:50]]></Time>
<TimeTick>1455711590</TimeTick>
<Step rID="T50">
<Obj plainTxt="False" ><![CDATA[NWPFE]]></Obj>
<Details plainTxt="False" ><![CDATA[Page]]></Details>
<Time><![CDATA[2/17/2016 - 13:19:50]]></Time>
<TimeTick>1455711590</TimeTick>
<Step rID="T51">
<Obj plainTxt="False" ><![CDATA[eleMiniShoppingBag.Exist]]></Obj>
<Details plainTxt="False" ><![CDATA["Object exists"]]></Details>
<Time><![CDATA[2/17/2016 - 13:19:50]]></Time>
<TimeTick>1455711590</TimeTick>
<NodeArgs eType="Replay" icon="11" nRep="100" >
<Disp><![CDATA[eleMiniShoppingBag.Exist]]></Disp>
</NodeArgs>
</Step>
<NodeArgs eType="Context" icon="6" nRep="99" >
<Disp><![CDATA[NWPFE]]></Disp>
</NodeArgs>
</Step>
<NodeArgs eType="Context" icon="5" nRep="98" >
<Disp><![CDATA[NWPFE]]></Disp>
</NodeArgs>
</Step>
<Step rID="T52">
<Obj ><![CDATA[FE_ClickOn_Link]]></Obj>
<Details ><![CDATA[Add to shopping bag link verified successfully.]]></Details>
<Time><![CDATA[2/17/2016 - 13:19:51]]></Time>
<TimeTick>1455711591</TimeTick>
<NodeArgs eType="User" icon="3" nRep="102" >
<Disp><![CDATA[FE_ClickOn_Link]]></Disp>
</NodeArgs>
</Step>
<Step rID="T53">
<Obj plainTxt="False" ><![CDATA[[ Add to shopping bag ].Click]]></Obj>
<Details plainTxt="False" ><![CDATA[]]></Details>
<Time><![CDATA[2/17/2016 - 13:19:51]]></Time>
<TimeTick>1455711591</TimeTick>
<NodeArgs eType="Replay" icon="8" nRep="104" >
<Disp><![CDATA[[ Add to shopping bag ].Click]]></Disp>
</NodeArgs>
</Step>
<Step rID="T54">
<Obj plainTxt="False" ><![CDATA[NWPFE]]></Obj>
<Details plainTxt="False" ><![CDATA[Browser]]></Details>
<Time><![CDATA[2/17/2016 - 13:19:54]]></Time>
<TimeTick>1455711594</TimeTick>
<Step rID="T55">
<Obj plainTxt="False" ><![CDATA[NWPFE]]></Obj>
<Details plainTxt="False" ><![CDATA[Page]]></Details>
<Time><![CDATA[2/17/2016 - 13:19:54]]></Time>
<TimeTick>1455711594</TimeTick>
<Step rID="T56">
<Obj plainTxt="False" ><![CDATA[NWPFE.Sync]]></Obj>
<Details plainTxt="False" ><![CDATA[]]></Details>
<Time><![CDATA[2/17/2016 - 13:19:54]]></Time>
<TimeTick>1455711594</TimeTick>
<NodeArgs eType="Replay" icon="6" nRep="109" >
<Disp><![CDATA[NWPFE.Sync]]></Disp>
</NodeArgs>
</Step>
<NodeArgs eType="Context" icon="6" nRep="108" >
<Disp><![CDATA[NWPFE]]></Disp>
</NodeArgs>
</Step>
<NodeArgs eType="Context" icon="5" nRep="107" >
<Disp><![CDATA[NWPFE]]></Disp>
</NodeArgs>
</Step>
<Step rID="T57">
<Obj ><![CDATA[FE_ClickOn_Link]]></Obj>
<Details ><![CDATA[Add to shopping bag link clicked successfully.]]></Details>
<Time><![CDATA[2/17/2016 - 13:19:58]]></Time>
<TimeTick>1455711598</TimeTick>
<NodeArgs eType="User" icon="3" nRep="110" >
<Disp><![CDATA[FE_ClickOn_Link]]></Disp>
</NodeArgs>
</Step>
<Step rID="T58">
<Obj ><![CDATA[FE_ClickOn_Link]]></Obj>
<Details ><![CDATA[ All links clicked successfully.]]></Details>
<Time><![CDATA[2/17/2016 - 13:19:59]]></Time>
<TimeTick>1455711599</TimeTick>
<NodeArgs eType="User" icon="3" nRep="111" >
<Disp><![CDATA[FE_ClickOn_Link]]></Disp>
</NodeArgs>
</Step>
<Step rID="T59">
<Obj plainTxt="False" ><![CDATA[NWPFE]]></Obj>
<Details plainTxt="False" ><![CDATA[Browser]]></Details>
<Time><![CDATA[2/17/2016 - 13:19:59]]></Time>
<TimeTick>1455711599</TimeTick>
<Step rID="T60">
<Obj plainTxt="False" ><![CDATA[NWPFE]]></Obj>
<Details plainTxt="False" ><![CDATA[Page]]></Details>
<Time><![CDATA[2/17/2016 - 13:19:59]]></Time>
<TimeTick>1455711599</TimeTick>
<Step rID="T61">
<Obj plainTxt="False" ><![CDATA[eleMiniShoppingBag.Exist]]></Obj>
<Details plainTxt="False" ><![CDATA["Object exists"]]></Details>
<Time><![CDATA[2/17/2016 - 13:19:59]]></Time>
<TimeTick>1455711599</TimeTick>
<NodeArgs eType="Replay" icon="11" nRep="114" >
<Disp><![CDATA[eleMiniShoppingBag.Exist]]></Disp>
</NodeArgs>
</Step>
<NodeArgs eType="Context" icon="6" nRep="113" >
<Disp><![CDATA[NWPFE]]></Disp>
</NodeArgs>
</Step>
<NodeArgs eType="Context" icon="5" nRep="112" >
<Disp><![CDATA[NWPFE]]></Disp>
</NodeArgs>
</Step>
<Step rID="T62">
<Obj ><![CDATA[Product is not added to the cart]]></Obj>
<Details ><![CDATA[Verify whether product is added to the basket ]]></Details>
<Time><![CDATA[2/17/2016 - 13:19:59]]></Time>
<TimeTick>1455711599</TimeTick>
<NodeArgs eType="User" icon="3" nRep="115" status="Warning" >
<Disp><![CDATA[Product is not added to the cart]]></Disp>
</NodeArgs>
</Step>
<Step rID="T63">
<Obj ><![CDATA[CaptureScreen]]></Obj>
<Details ><![CDATA[Application Error Snapshot]]></Details>
<Time><![CDATA[2/17/2016 - 13:19:59]]></Time>
<TimeTick>1455711599</TimeTick>
<NodeArgs eType="User" icon="3" nRep="116" status="Warning" >
<Disp><![CDATA[CaptureScreen]]></Disp>
<BtmPane vType="ViewerGen.SSViewerGen" >
<Path><![CDATA[ZIP::Act0\Row0\ssf1.xml]]></Path>
</BtmPane>
</NodeArgs>
</Step>
<Step rID="T64">
<Obj plainTxt="False" ><![CDATA[NWPFE]]></Obj>
<Details plainTxt="False" ><![CDATA[Browser]]></Details>
<Time><![CDATA[2/17/2016 - 13:19:59]]></Time>
<TimeTick>1455711599</TimeTick>
<Step rID="T65">
<Obj plainTxt="False" ><![CDATA[NWPFE]]></Obj>
<Details plainTxt="False" ><![CDATA[Page]]></Details>
<Time><![CDATA[2/17/2016 - 13:19:59]]></Time>
<TimeTick>1455711599</TimeTick>
<Step rID="T66">
<Obj plainTxt="False" ><![CDATA[NWPFE.Sync]]></Obj>
<Details plainTxt="False" ><![CDATA[]]></Details>
<Time><![CDATA[2/17/2016 - 13:19:59]]></Time>
<TimeTick>1455711599</TimeTick>
<NodeArgs eType="Replay" icon="6" nRep="121" >
<Disp><![CDATA[NWPFE.Sync]]></Disp>
</NodeArgs>
</Step>
<Step rID="T67">
<Obj plainTxt="False" ><![CDATA[NWPFE.Sync]]></Obj>
<Details plainTxt="False" ><![CDATA[]]></Details>
<Time><![CDATA[2/17/2016 - 13:20:07]]></Time>
<TimeTick>1455711607</TimeTick>
<NodeArgs eType="Replay" icon="6" nRep="124" >
<Disp><![CDATA[NWPFE.Sync]]></Disp>
</NodeArgs>
</Step>
<NodeArgs eType="Context" icon="6" nRep="120" >
<Disp><![CDATA[NWPFE]]></Disp>
</NodeArgs>
</Step>
<NodeArgs eType="Context" icon="5" nRep="119" >
<Disp><![CDATA[NWPFE]]></Disp>
</NodeArgs>
</Step>
<Step rID="T68">
<Obj ><![CDATA[TS_Wave3_NWP_ST_FE_Positive_Auto_Orderconfirmation_CreditCards]]></Obj>
<Details ><![CDATA[Order has not been placed successfully by business customer]]></Details>
<Time><![CDATA[2/17/2016 - 13:20:12]]></Time>
<TimeTick>1455711612</TimeTick>
<NodeArgs eType="User" icon="3" nRep="125" status="Warning" >
<Disp><![CDATA[TS_Wave3_NWP_ST_FE_Positive_Auto_Orderconfirmation_CreditCards]]></Disp>
</NodeArgs>
</Step>
<Step rID="T69">
<Obj ><![CDATA[CaptureScreen]]></Obj>
<Details ><![CDATA[Application Error Snapshot]]></Details>
<Time><![CDATA[2/17/2016 - 13:20:12]]></Time>
<TimeTick>1455711612</TimeTick>
<NodeArgs eType="User" icon="3" nRep="126" status="Warning" >
<Disp><![CDATA[CaptureScreen]]></Disp>
<BtmPane vType="ViewerGen.SSViewerGen" >
<Path><![CDATA[ZIP::Act0\Row0\ssf2.xml]]></Path>
</BtmPane>
</NodeArgs>
</Step>
<Step rID="T70">
<Obj ><![CDATA[TS_Wave3_NWP_ST_FE_Positive_Auto_Orderconfirmation_CreditCards]]></Obj>
<Details ><![CDATA[FAIL]]></Details>
<Time><![CDATA[2/17/2016 - 13:20:13]]></Time>
<TimeTick>1455711613</TimeTick>
<NodeArgs eType="User" icon="3" nRep="127" status="Failed" >
<Disp><![CDATA[TS_Wave3_NWP_ST_FE_Positive_Auto_Orderconfirmation_CreditCards]]></Disp>
</NodeArgs>
</Step>
<Step rID="T71">
<Obj plainTxt="False" ><![CDATA[[ SKORVA Midbeam Galvanised - IKEA ].Exist]]></Obj>
<Details plainTxt="False" ><![CDATA["Object exists"]]></Details>
<Time><![CDATA[2/17/2016 - 13:20:17]]></Time>
<TimeTick>1455711617</TimeTick>
<NodeArgs eType="Replay" icon="5" nRep="128" >
<Disp><![CDATA[[ SKORVA Midbeam Galvanised - IKEA ].Exist]]></Disp>
</NodeArgs>
</Step>
<Step rID="T72">
<Obj plainTxt="False" ><![CDATA[[ SKORVA Midbeam Galvanised - IKEA ].Close]]></Obj>
<Details plainTxt="False" ><![CDATA[]]></Details>
<Time><![CDATA[2/17/2016 - 13:20:17]]></Time>
<TimeTick>1455711617</TimeTick>
<NodeArgs eType="Replay" icon="5" nRep="129" >
<Disp><![CDATA[[ SKORVA Midbeam Galvanised - IKEA ].Close]]></Disp>
</NodeArgs>
</Step>
<Step rID="T73">
<Obj plainTxt="False" ><![CDATA[[ Browser ].Exist]]></Obj>
<Details plainTxt="False" ><![CDATA["Object does not exist"]]></Details>
<Time><![CDATA[2/17/2016 - 13:20:20]]></Time>
<TimeTick>1455711620</TimeTick>
<NodeArgs eType="Replay" icon="5" nRep="131" >
<Disp><![CDATA[[ Browser ].Exist]]></Disp>
</NodeArgs>
</Step>
<Summary sTime="2/17/2016 - 13:18:58" eTime="2/17/2016 - 13:20:21" passed="2" failed="1" warnings="4" ></Summary>
<NodeArgs eType="StartAction" icon="4" nRep="7" status="Failed" >
<Disp><![CDATA[Driver Summary]]></Disp>
</NodeArgs>
</Action>
<Summary sTime="2/17/2016 - 13:18:54" eTime="2/17/2016 - 13:20:21" passed="3" failed="1" warnings="4" ></Summary>
<NodeArgs eType="StartTest" icon="1" nRep="3" status="Failed" >
<Disp><![CDATA[Test Driver Summary]]></Disp>
</NodeArgs>
</Doc>
</Report>